{
  "schemaVersion": "1.0",
  "jobId": "hw-division-001",
  "title": "同じ数ずつ分けるには？",
  "problem": {
    "text": "りんごが24個あります。3人で同じ数ずつ分けます。1人分は何個ですか。",
    "studentAnswer": "24 - 3 = 21",
    "correctAnswer": "24 ÷ 3 = 8"
  },
  "panels": [
    {
      "panelNumber": 1,
      "learningPurpose": "問題場面と誤答を確認する",
      "scene": "りんごを前に、ハルが考えている",
      "characters": ["hero"],
      "characterPose": { "hero": "thinking" },
      "characterExpression": { "hero": "confused" },
      "background": "classroom",
      "props": ["apples"],
      "dialogue": [{ "speaker": "ハル", "text": "3人だから、24から3を引くのかな？", "tone": "question" }],
      "narration": "ハルは「3人」という数字に注目しました。",
      "visualAid": null,
      "formula": ["24 − 3 = 21"],
      "emphasisWords": ["3人"],
      "layout": { "size": "medium", "characterSide": "left", "visualAidPosition": "right" },
      "assetIds": ["dummy-hero-confused"]
    },
    {
      "panelNumber": 2,
      "learningPurpose": "引き算の意味との違いに気付く",
      "scene": "先生が3個だけ取り除いて見せる",
      "characters": ["teacher", "hero"],
      "characterPose": { "teacher": "pointing", "hero": "watching" },
      "characterExpression": { "teacher": "calm", "hero": "surprised" },
      "background": "classroom",
      "props": ["apples"],
      "dialogue": [{ "speaker": "先生", "text": "3を引くと、3個を取りのぞくことになるよ。", "tone": "normal" }],
      "narration": "24−3では、3人に分けたことになりません。",
      "visualAid": null,
      "formula": ["24 − 3 = 21"],
      "emphasisWords": ["3個", "取りのぞく"],
      "layout": { "size": "medium", "characterSide": "right", "visualAidPosition": "bottom" },
      "assetIds": ["dummy-teacher-pointing"]
    },
    {
      "panelNumber": 3,
      "learningPurpose": "等分する操作を具体化する",
      "scene": "24個を3つの箱へ順番に入れる",
      "characters": ["teacher", "hero"],
      "characterPose": { "teacher": "distributing", "hero": "counting" },
      "characterExpression": { "teacher": "smile", "hero": "focused" },
      "background": "classroom",
      "props": ["apples", "three-boxes"],
      "dialogue": [{ "speaker": "先生", "text": "3人に同じ数ずつ、1個ずつ配ってみよう。", "tone": "encourage" }],
      "narration": "どの人の数も同じになるように分けます。",
      "visualAid": { "type": "bar_model", "total": 24, "groups": 3, "perGroup": 8, "label": "1人分" },
      "formula": [],
      "emphasisWords": ["同じ数ずつ"],
      "layout": { "size": "large", "characterSide": "left", "visualAidPosition": "right" },
      "assetIds": ["dummy-teacher-smile"]
    },
    {
      "panelNumber": 4,
      "learningPurpose": "横棒図から1グループ分を読む",
      "scene": "3等分された横棒図を確認する",
      "characters": ["hero"],
      "characterPose": { "hero": "pointing" },
      "characterExpression": { "hero": "discovery" },
      "background": "notebook",
      "props": [],
      "dialogue": [{ "speaker": "ハル", "text": "24個が3つに同じように分かれて、1人分は8個だ！", "tone": "discovery" }],
      "narration": null,
      "visualAid": { "type": "bar_model", "total": 24, "groups": 3, "perGroup": 8, "label": "1人分" },
      "formula": [],
      "emphasisWords": ["3つ", "1人分", "8個"],
      "layout": { "size": "large", "characterSide": "right", "visualAidPosition": "center" },
      "assetIds": ["dummy-hero-discovery"]
    },
    {
      "panelNumber": 5,
      "learningPurpose": "等分の場面を割り算の式にする",
      "scene": "先生が横棒図と割り算を結び付ける",
      "characters": ["teacher", "hero"],
      "characterPose": { "teacher": "pointing", "hero": "writing" },
      "characterExpression": { "teacher": "smile", "hero": "focused" },
      "background": "blackboard",
      "props": ["chalk"],
      "dialogue": [{ "speaker": "先生", "text": "同じ数ずつ分けるときは、割り算で表せるよ。", "tone": "normal" }],
      "narration": "全部の数 ÷ 人数 ＝ 1人分の数",
      "visualAid": null,
      "formula": ["24 ÷ 3 = 8"],
      "emphasisWords": ["同じ数ずつ", "割り算"],
      "layout": { "size": "medium", "characterSide": "left", "visualAidPosition": "bottom" },
      "assetIds": ["dummy-teacher-pointing"]
    },
    {
      "panelNumber": 6,
      "learningPurpose": "正答と判断の手掛かりを定着させる",
      "scene": "ハルが正しい答えを書き、笑顔になる",
      "characters": ["hero"],
      "characterPose": { "hero": "writing" },
      "characterExpression": { "hero": "happy" },
      "background": "classroom",
      "props": ["notebook", "pencil"],
      "dialogue": [{ "speaker": "ハル", "text": "「同じ数ずつ」が合図！ 24÷3で、答えは8個！", "tone": "discovery" }],
      "narration": "まちがいは、考え方を見つけるヒントになります。",
      "visualAid": null,
      "formula": ["24 ÷ 3 = 8", "答え 8個"],
      "emphasisWords": ["同じ数ずつ", "8個"],
      "layout": { "size": "medium", "characterSide": "right", "visualAidPosition": "bottom" },
      "assetIds": ["dummy-hero-happy"]
    }
  ]
}
